{
  "schema": "pattern-card/1",
  "platform": "ios",
  "archetype": "password-change",
  "status": "draft",
  "n": 6,
  "n_below_floor": true,
  "attempted": 6,
  "captured_at": {"from": "unknown", "to": "unknown"},
  "extraction": {
    "model": "gemini-3.8-flash-medium",
    "cross_check": {
      "model": "gemini-3.1-pro-high",
      "images": 10,
      "agreement": [
        {"attribute": "components.forgot-link", "agree": 1, "of": 1},
        {"attribute": "components.password-fields", "agree": 1, "of": 1},
        {"attribute": "components.password-fields.kind", "agree": 1, "of": 1},
        {"attribute": "components.password-fields.position", "agree": 1, "of": 1},
        {"attribute": "components.primary-cta", "agree": 1, "of": 1},
        {"attribute": "components.primary-cta.kind", "agree": 1, "of": 1},
        {"attribute": "components.primary-cta.position", "agree": 1, "of": 1},
        {"attribute": "components.requirements-list", "agree": 1, "of": 1},
        {"attribute": "components.show-hide-toggle", "agree": 1, "of": 1},
        {"attribute": "components.strength-indicator", "agree": 1, "of": 1},
        {"attribute": "core.color_mode", "agree": 10, "of": 10},
        {"attribute": "core.copy_language", "agree": 10, "of": 10},
        {"attribute": "core.density", "agree": 7, "of": 10},
        {"attribute": "core.layout", "agree": 9, "of": 10},
        {"attribute": "core.navigation", "agree": 9, "of": 10},
        {"attribute": "core.primary_action", "agree": 8, "of": 10},
        {"attribute": "core.states", "agree": 8, "of": 10}
      ]
    }
  },
  "core": {
    "layout": [{"value": "bottom-sheet", "count": 3}, {"value": "single-column-scroll", "count": 3}],
    "navigation": [{"value": "back-header", "count": 6}],
    "primary_action": [
      {"value": "none", "count": 3},
      {"value": "filled-button-inline", "count": 2},
      {"value": "filled-button-sticky-bottom", "count": 1}
    ],
    "density": [{"value": "comfortable", "count": 3}, {"value": "spacious", "count": 3}],
    "color_mode": [{"value": "light", "count": 6}],
    "copy_language": [{"value": "en", "count": 6}],
    "states": [
      {"value": "empty", "count": 3},
      {"value": "none", "count": 2},
      {"value": "disabled", "count": 1},
      {"value": "success", "count": 1}
    ]
  },
  "components": [
    {
      "name": "password-fields",
      "count": 3,
      "kind": [{"value": "current-new-confirm", "count": 2}, {"value": "other", "count": 1}],
      "position": [{"value": "main", "count": 3}]
    },
    {"name": "strength-indicator", "count": 0},
    {"name": "requirements-list", "count": 0},
    {
      "name": "show-hide-toggle",
      "count": 2,
      "kind": [{"value": "eye-icon", "count": 2}],
      "position": [{"value": "inline", "count": 2}]
    },
    {
      "name": "primary-cta",
      "count": 3,
      "kind": [{"value": "filled-full-width", "count": 3}],
      "position": [{"value": "other", "count": 2}, {"value": "bottom-fixed", "count": 1}]
    },
    {
      "name": "forgot-link",
      "count": 1,
      "kind": [{"value": "link", "count": 1}],
      "position": [{"value": "below", "count": 1}]
    }
  ],
  "evidence": [
    "observed(mobbin:ccb13ed8-76ae-4879-b367-67f6eaf24173)",
    "observed(mobbin:ddf2903b-9ab7-47d5-b699-80acd9cdf5a0)",
    "observed(mobbin:9010b5f7-7047-4703-b54e-b3f2209e703a)",
    "observed(mobbin:62716fa4-6b45-4a76-a2d8-074d2b94349f)",
    "observed(mobbin:efb513f2-d69e-45f1-a108-bc0ff4f0c8ef)",
    "observed(mobbin:5020f32f-7150-48ed-872a-b3cd4c9b3df7)"
  ],
  "notes": "6 of 6 screens extracted (one image per call, categorical fields only); every count is computed from the per-image JSON. Below the n=8 floor: draft, do not treat the shares as a pattern. The available set is 6 screens from 2 products."
}
