{
  "schema": "pattern-card/1",
  "platform": "web",
  "archetype": "onboarding",
  "status": "published",
  "n": 8,
  "attempted": 8,
  "captured_at": {"from": "unknown", "to": "unknown"},
  "extraction": {
    "model": "gemini-3.8-flash-medium",
    "cross_check": {
      "model": "gemini-3.1-pro-high",
      "images": 10,
      "agreement": [
        {"attribute": "core.color_mode", "agree": 10, "of": 10},
        {"attribute": "core.copy_language", "agree": 10, "of": 10},
        {"attribute": "core.density", "agree": 7, "of": 10},
        {"attribute": "core.layout", "agree": 9, "of": 10},
        {"attribute": "core.navigation", "agree": 9, "of": 10},
        {"attribute": "core.primary_action", "agree": 8, "of": 10},
        {"attribute": "core.states", "agree": 8, "of": 10}
      ]
    }
  },
  "core": {
    "layout": [{"value": "centered-card", "count": 4}, {"value": "topnav+main", "count": 3}, {"value": "split-panel", "count": 1}],
    "navigation": [
      {"value": "back-header", "count": 2},
      {"value": "none", "count": 2},
      {"value": "topnav", "count": 2},
      {"value": "other", "count": 1},
      {"value": "stepper", "count": 1}
    ],
    "primary_action": [{"value": "filled-button-inline", "count": 7}, {"value": "outline-button", "count": 1}],
    "density": [{"value": "spacious", "count": 5}, {"value": "comfortable", "count": 3}],
    "color_mode": [{"value": "light", "count": 8}],
    "copy_language": [{"value": "en", "count": 8}],
    "states": [{"value": "selected", "count": 5}, {"value": "none", "count": 2}, {"value": "empty", "count": 1}]
  },
  "components": [
    {
      "name": "progress-indicator",
      "count": 8,
      "kind": [{"value": "bar", "count": 4}, {"value": "dots", "count": 2}, {"value": "stepper", "count": 2}],
      "position": [{"value": "top", "count": 6}, {"value": "bottom", "count": 2}]
    },
    {
      "name": "choice-cards",
      "count": 5,
      "kind": [{"value": "single-select", "count": 5}],
      "position": [{"value": "center", "count": 5}]
    },
    {
      "name": "form-fields",
      "count": 3,
      "kind": [{"value": "single", "count": 2}, {"value": "multiple", "count": 1}],
      "position": [{"value": "center", "count": 3}]
    },
    {
      "name": "skip-action",
      "count": 4,
      "kind": [{"value": "button", "count": 3}, {"value": "text-link", "count": 1}],
      "position": [{"value": "top-right", "count": 3}, {"value": "bottom", "count": 1}]
    },
    {
      "name": "illustration",
      "count": 2,
      "kind": [{"value": "photo", "count": 1}, {"value": "product-mock", "count": 1}],
      "position": [{"value": "background", "count": 1}, {"value": "right-half", "count": 1}]
    },
    {
      "name": "primary-cta",
      "count": 8,
      "kind": [{"value": "filled", "count": 7}, {"value": "outline", "count": 1}],
      "position": [
        {"value": "bottom-inline", "count": 3},
        {"value": "centered", "count": 3},
        {"value": "bottom-right", "count": 1},
        {"value": "other", "count": 1}
      ]
    }
  ],
  "evidence": [
    "observed(mobbin:fbb531f0-5837-44f8-83f8-3643208a17a5)",
    "observed(mobbin:ece244bb-b561-4552-8e5c-b94fa94b7b36)",
    "observed(mobbin:4eb86098-ba6d-49a0-af5d-1403cdd8e69f)",
    "observed(mobbin:640aed2c-d34d-4948-9ee8-86e659c5f8f0)",
    "observed(mobbin:78c00d03-f3ab-404d-9508-89d2bad15b14)",
    "observed(mobbin:6285fdec-d5dc-4a1e-9e16-30d8e00afa6a)",
    "observed(mobbin:13152f0b-7136-4389-af0a-b855262ba5eb)",
    "observed(mobbin:1380ff1b-e92b-4330-a2e0-f0bd1b5cc5e8)"
  ],
  "notes": "8 of 8 screens extracted (one image per call, categorical fields only); every count is computed from the per-image JSON."
}
