{
  "schema": "pattern-card/1",
  "platform": "ios",
  "archetype": "home-feed",
  "status": "published",
  "n": 8,
  "attempted": 8,
  "captured_at": {"from": "unknown", "to": "unknown"},
  "extraction": {
    "model": "gemini-3.8-flash-medium",
    "cross_check": {
      "model": "gemini-3.1-pro-high",
      "images": 10,
      "agreement": [
        {"attribute": "components.content-feed", "agree": 1, "of": 1},
        {"attribute": "components.content-feed.kind", "agree": 0, "of": 1},
        {"attribute": "components.content-feed.position", "agree": 1, "of": 1},
        {"attribute": "components.floating-action", "agree": 1, "of": 1},
        {"attribute": "components.section-headers", "agree": 1, "of": 1},
        {"attribute": "components.stories-row", "agree": 1, "of": 1},
        {"attribute": "components.tab-bar", "agree": 1, "of": 1},
        {"attribute": "components.tab-bar.kind", "agree": 1, "of": 1},
        {"attribute": "components.tab-bar.position", "agree": 1, "of": 1},
        {"attribute": "components.top-bar", "agree": 1, "of": 1},
        {"attribute": "components.top-bar.kind", "agree": 1, "of": 1},
        {"attribute": "components.top-bar.position", "agree": 1, "of": 1},
        {"attribute": "core.color_mode", "agree": 10, "of": 10},
        {"attribute": "core.copy_language", "agree": 10, "of": 10},
        {"attribute": "core.density", "agree": 7, "of": 10},
        {"attribute": "core.layout", "agree": 9, "of": 10},
        {"attribute": "core.navigation", "agree": 9, "of": 10},
        {"attribute": "core.primary_action", "agree": 8, "of": 10},
        {"attribute": "core.states", "agree": 8, "of": 10}
      ]
    }
  },
  "core": {
    "layout": [{"value": "tab-bar+content", "count": 7}, {"value": "topnav+main", "count": 1}],
    "navigation": [{"value": "tab-bar", "count": 7}, {"value": "top-tabs", "count": 1}],
    "primary_action": [
      {"value": "filled-button-inline", "count": 2},
      {"value": "floating-action", "count": 2},
      {"value": "none", "count": 2},
      {"value": "outline-button", "count": 1},
      {"value": "text-link", "count": 1}
    ],
    "density": [{"value": "comfortable", "count": 8}],
    "color_mode": [{"value": "light", "count": 6}, {"value": "dark", "count": 2}],
    "copy_language": [{"value": "en", "count": 7}, {"value": "mixed", "count": 1}],
    "states": [{"value": "selected", "count": 8}, {"value": "loading", "count": 1}]
  },
  "components": [
    {
      "name": "top-bar",
      "count": 8,
      "kind": [{"value": "other", "count": 4}, {"value": "logo", "count": 2}, {"value": "search-bar", "count": 2}],
      "position": [{"value": "top", "count": 8}]
    },
    {
      "name": "content-feed",
      "count": 8,
      "kind": [{"value": "vertical-cards", "count": 7}, {"value": "mixed-sections", "count": 1}],
      "position": [{"value": "main", "count": 8}]
    },
    {
      "name": "tab-bar",
      "count": 7,
      "kind": [{"value": "floating", "count": 4}, {"value": "icons-labels", "count": 3}],
      "position": [{"value": "bottom", "count": 7}]
    },
    {
      "name": "stories-row",
      "count": 1,
      "kind": [{"value": "circles", "count": 1}],
      "position": [{"value": "top", "count": 1}]
    },
    {
      "name": "floating-action",
      "count": 3,
      "kind": [{"value": "fab", "count": 3}],
      "position": [{"value": "bottom-right", "count": 3}]
    },
    {
      "name": "section-headers",
      "count": 2,
      "kind": [{"value": "other", "count": 1}, {"value": "title-only", "count": 1}],
      "position": [{"value": "inline", "count": 2}]
    }
  ],
  "evidence": [
    "observed(mobbin:fd330182-950b-40b8-8e53-9fa2b9985df0)",
    "observed(mobbin:e43ed176-52b2-4510-8d67-377110f1122d)",
    "observed(mobbin:cce76543-0fa1-4f85-9202-4657124e6ac6)",
    "observed(mobbin:a7c20d58-3803-40b3-a953-837f7546b6db)",
    "observed(mobbin:0ffe05f5-fc89-47f9-8856-ce81d86e817a)",
    "observed(mobbin:3258e2fe-5dcc-4ed1-88a5-1657d873a3df)",
    "observed(mobbin:d484983a-0541-434f-bc54-646a8013b35f)",
    "observed(mobbin:25f45fcc-6f89-4138-ae7b-0e2591b1588e)"
  ],
  "notes": "8 of 8 screens extracted (one image per call, categorical fields only); every count is computed from the per-image JSON."
}
