{
  "schema": "pattern-card/1",
  "platform": "ios",
  "archetype": "product-detail",
  "status": "published",
  "n": 8,
  "attempted": 8,
  "captured_at": {"from": "unknown", "to": "unknown"},
  "extraction": {
    "model": "gemini-3.8-flash-medium",
    "cross_check": {
      "model": "gemini-3.1-pro-high",
      "images": 10,
      "agreement": [
        {"attribute": "components.media-hero", "agree": 1, "of": 1},
        {"attribute": "components.media-hero.kind", "agree": 1, "of": 1},
        {"attribute": "components.media-hero.position", "agree": 1, "of": 1},
        {"attribute": "components.price-and-title", "agree": 1, "of": 1},
        {"attribute": "components.price-and-title.kind", "agree": 1, "of": 1},
        {"attribute": "components.price-and-title.position", "agree": 1, "of": 1},
        {"attribute": "components.purchase-cta", "agree": 1, "of": 1},
        {"attribute": "components.reviews", "agree": 1, "of": 1},
        {"attribute": "components.share-favorite", "agree": 1, "of": 1},
        {"attribute": "components.share-favorite.kind", "agree": 1, "of": 1},
        {"attribute": "components.share-favorite.position", "agree": 1, "of": 1},
        {"attribute": "components.variant-selector", "agree": 1, "of": 1},
        {"attribute": "components.variant-selector.kind", "agree": 1, "of": 1},
        {"attribute": "components.variant-selector.position", "agree": 1, "of": 1},
        {"attribute": "core.color_mode", "agree": 10, "of": 10},
        {"attribute": "core.copy_language", "agree": 10, "of": 10},
        {"attribute": "core.density", "agree": 7, "of": 10},
        {"attribute": "core.layout", "agree": 9, "of": 10},
        {"attribute": "core.navigation", "agree": 9, "of": 10},
        {"attribute": "core.primary_action", "agree": 8, "of": 10},
        {"attribute": "core.states", "agree": 8, "of": 10}
      ]
    }
  },
  "core": {
    "layout": [
      {"value": "bottom-sheet", "count": 3},
      {"value": "single-column-scroll", "count": 3},
      {"value": "tab-bar+content", "count": 2}
    ],
    "navigation": [{"value": "back-header", "count": 3}, {"value": "other", "count": 3}, {"value": "tab-bar", "count": 2}],
    "primary_action": [
      {"value": "filled-button-sticky-bottom", "count": 5},
      {"value": "filled-button-inline", "count": 1},
      {"value": "floating-action", "count": 1},
      {"value": "none", "count": 1}
    ],
    "density": [{"value": "comfortable", "count": 8}],
    "color_mode": [{"value": "light", "count": 8}],
    "copy_language": [{"value": "en", "count": 7}, {"value": "mixed", "count": 1}],
    "states": [{"value": "selected", "count": 5}, {"value": "disabled", "count": 3}, {"value": "none", "count": 2}]
  },
  "components": [
    {
      "name": "media-hero",
      "count": 4,
      "kind": [
        {"value": "carousel", "count": 1},
        {"value": "full-bleed-image", "count": 1},
        {"value": "other", "count": 1},
        {"value": "thumbnail", "count": 1}
      ],
      "position": [{"value": "top", "count": 4}]
    },
    {
      "name": "price-and-title",
      "count": 5,
      "kind": [{"value": "other", "count": 3}, {"value": "stacked", "count": 2}],
      "position": [{"value": "below-media", "count": 3}, {"value": "other", "count": 2}]
    },
    {
      "name": "purchase-cta",
      "count": 7,
      "kind": [
        {"value": "sticky-bottom-bar", "count": 5},
        {"value": "inline-button", "count": 1},
        {"value": "other", "count": 1}
      ],
      "position": [{"value": "bottom-fixed", "count": 6}, {"value": "inline", "count": 1}]
    },
    {
      "name": "variant-selector",
      "count": 5,
      "kind": [{"value": "chips", "count": 4}, {"value": "picker", "count": 1}],
      "position": [{"value": "below-price", "count": 4}, {"value": "other", "count": 1}]
    },
    {
      "name": "reviews",
      "count": 1,
      "kind": [{"value": "summary", "count": 1}],
      "position": [{"value": "other", "count": 1}]
    },
    {
      "name": "share-favorite",
      "count": 4,
      "kind": [{"value": "nav-icons", "count": 4}],
      "position": [{"value": "top-right", "count": 3}, {"value": "other", "count": 1}]
    }
  ],
  "evidence": [
    "observed(mobbin:e54edcf8-8c03-4b63-b446-e628ac634d9a)",
    "observed(mobbin:97f73a42-e077-4ca7-807d-fec4f80c02d8)",
    "observed(mobbin:5e7aabb9-eef8-4a90-bacc-eb15c521a417)",
    "observed(mobbin:68ce0af2-db40-432a-9fee-1a77359c8135)",
    "observed(mobbin:9b46f142-51a4-4030-85fa-38bdb1ad751e)",
    "observed(mobbin:5881ae47-b2b3-4f57-9344-7b2d0e94a2cc)",
    "observed(mobbin:502f3118-56b8-48fd-98e3-dff689a6f2a9)",
    "observed(mobbin:fad714ef-0006-46a0-abe1-00e2fa1257f7)"
  ],
  "notes": "8 of 8 screens extracted (one image per call, categorical fields only); every count is computed from the per-image JSON."
}
